{
  "analysis_version": 3,
  "flags": [
    "dropped"
  ],
  "metrics": {
    "bot_cpu_frac_load": {
      "availability": "unavailable",
      "n": null,
      "reason": "the load window was not reached",
      "unit": "frac",
      "value": null,
      "window": "load"
    },
    "bot_cpu_frac_steady": {
      "availability": "unavailable",
      "n": null,
      "reason": "the steady window was not reached",
      "unit": "frac",
      "value": null,
      "window": "steady"
    },
    "chunks_per_bot": {
      "availability": "unavailable",
      "n": null,
      "reason": "the load window was not reached",
      "unit": "chunks",
      "value": null,
      "window": "load"
    },
    "chunks_per_s_load": {
      "availability": "unavailable",
      "n": null,
      "reason": "the load window was not reached",
      "unit": "chunks_per_s",
      "value": null,
      "window": "load"
    },
    "csg_effective": {
      "availability": "unavailable",
      "n": null,
      "reason": "the load window was not reached",
      "unit": "bool",
      "value": null,
      "window": "load"
    },
    "decode_errors": {
      "availability": "measured",
      "n": null,
      "unit": "count",
      "value": 0,
      "window": "run"
    },
    "died_during_run": {
      "availability": "measured",
      "n": null,
      "unit": "bool",
      "value": true,
      "window": "run"
    },
    "dropped": {
      "availability": "measured",
      "n": null,
      "unit": "count",
      "value": 6,
      "window": "run"
    },
    "foreign_cores_load": {
      "availability": "unavailable",
      "n": null,
      "reason": "the load window was not reached",
      "unit": "cores",
      "value": null,
      "window": "load"
    },
    "foreign_cores_peak_10s_load": {
      "availability": "unavailable",
      "n": null,
      "reason": "the load window was not reached",
      "unit": "cores",
      "value": null,
      "window": "load"
    },
    "foreign_cores_peak_10s_steady": {
      "availability": "unavailable",
      "n": null,
      "reason": "the steady window was not reached",
      "unit": "cores",
      "value": null,
      "window": "steady"
    },
    "foreign_cores_steady": {
      "availability": "unavailable",
      "n": null,
      "reason": "the steady window was not reached",
      "unit": "cores",
      "value": null,
      "window": "steady"
    },
    "foreign_server_set_cores_load": {
      "availability": "unavailable",
      "n": null,
      "reason": "the load window was not reached",
      "unit": "cores",
      "value": null,
      "window": "load"
    },
    "foreign_server_set_cores_steady": {
      "availability": "unavailable",
      "n": null,
      "reason": "the steady window was not reached",
      "unit": "cores",
      "value": null,
      "window": "steady"
    },
    "interventions_in_measured": {
      "availability": "unavailable",
      "n": null,
      "reason": "the steady window was not reached",
      "unit": "count",
      "value": null,
      "window": "steady"
    },
    "joined": {
      "availability": "measured",
      "n": null,
      "unit": "count",
      "value": 6,
      "window": "run"
    },
    "private_mib_steady": {
      "availability": "unavailable",
      "n": null,
      "reason": "the steady window was not reached",
      "unit": "mib",
      "value": null,
      "window": "steady"
    },
    "probe_idle_ticks": {
      "availability": "measured",
      "n": 4,
      "unit": "ticks",
      "value": 300,
      "window": "idle"
    },
    "probe_latency_ms_steady": {
      "availability": "unavailable",
      "n": null,
      "reason": "the steady window was not reached",
      "unit": "ms",
      "value": null,
      "window": "steady"
    },
    "probe_max_gap_s_load": {
      "availability": "unavailable",
      "n": null,
      "reason": "the load window was not reached",
      "unit": "s",
      "value": null,
      "window": "load"
    },
    "probe_max_gap_s_steady": {
      "availability": "unavailable",
      "n": null,
      "reason": "the steady window was not reached",
      "unit": "s",
      "value": null,
      "window": "steady"
    },
    "probe_tick_decreases": {
      "availability": "measured",
      "n": 17,
      "unit": "count",
      "value": 0,
      "window": "run"
    },
    "process_cores_steady": {
      "availability": "unavailable",
      "n": null,
      "reason": "the steady window was not reached",
      "unit": "cores",
      "value": null,
      "window": "steady"
    },
    "server_exit_code": {
      "availability": "measured",
      "n": null,
      "unit": "code",
      "value": -6,
      "window": "run"
    },
    "tick_cpu_ms_per_tick_steady": {
      "availability": "unavailable",
      "n": null,
      "reason": "the steady window was not reached",
      "unit": "ms_per_tick",
      "value": null,
      "window": "steady"
    },
    "tps_load_low5": {
      "availability": "unavailable",
      "n": null,
      "reason": "the load window was not reached",
      "unit": "tps",
      "value": null,
      "window": "load"
    },
    "tps_window_steady": {
      "availability": "unavailable",
      "n": null,
      "reason": "the steady window was not reached",
      "unit": "tps",
      "value": null,
      "window": "steady"
    },
    "view_t90_own_s": {
      "availability": "unavailable",
      "n": null,
      "reason": "the load window was not reached",
      "unit": "s",
      "value": null,
      "window": "load"
    },
    "view_t_n_s": {
      "availability": "unavailable",
      "n": null,
      "reason": "the load window was not reached",
      "unit": "s",
      "value": null,
      "window": "load"
    }
  },
  "run_id": "20261012T135800Z-synthetic@1.0-r1-e6ce",
  "schema": "bedrock-bench/metrics/1",
  "schema_minor": 0,
  "status": "server_failed",
  "status_reasons": [
    "server_alive: the server exited before teardown"
  ]
}
